{
  "$schema": "http://json-schema.org/draft-07/schema#",
  "title": "CutoffMetadata",
  "type": "object",
  "properties": {
    "year": {
      "type": "integer"
    },
    "branch": {
      "type": "string"
    },
    "category": {
      "type": "string"
    },
    "qualifying_marks": {
      "type": "number"
    },
    "highest_score": {
      "type": "number"
    },
    "gate_score_mapping": {
      "type": "array"
    },
    "approx_air_mapping": {
      "type": "array"
    },
    "metadata": {
      "type": "object"
    }
  },
  "required": [
    "year",
    "branch",
    "category",
    "qualifying_marks"
  ]
}